No,theme,title_en,desc_en,title_ja,desc_ja,copy_right,ai_flag,taste_category,character_category,zip_path
6,保留・多忙のアピール,Hold On Huge Font: Busy Life,Standard busy words like 'Checking now' and 'Wait a sec'. Huge fonts to manage expectations when you're overwhelmed with work tasks.,今は無理…多忙を伝える省エネ保留デカ文字,「確認します」「ちょっと待って」「会議中」など、即レスできない時の標準フレーズ。相手を待たせている罪悪感を、愛嬌のあるデカ文字キャラが省エネで和らげてくれます。,©ryo,TRUE,敬語・丁寧,男性キャラ,
7,謝罪と反省の省エネ,Apology Standard Huge Font,Standard apologies like 'Sorry' and 'My bad'. Huge fonts deliver your sincerity even with minimal effort. Essential for everyday office life.,省エネ謝罪。一言で許しを請うサラリーマンの平謝り,「すみません」「申し訳ない」「反省」など、日常のちょっとしたミスに使える謝罪ワード。デカ文字の視覚効果で、言葉を尽くすよりも誠実（？）に、かつ省エネに謝意が伝わります。,©ryo,TRUE,シュール,男性キャラ,
8,疑問・確認の省エネ,Quick Questions Huge Font,"Essential questions like 'Where?', 'When?', and 'What?'. Huge fonts for efficient information gathering with your busy colleagues.",省エネ質問！一瞬で確認をとる極太クエスチョン,「いつ？」「どこ？」「OK？」など、確認事項をデカ文字だけで。余計な言葉を削ぎ落とした省エネスタイルで、忙しい相手からも爆速で回答を引き出すための実用セット。,©ryo,TRUE,面白い・ネタ,男性キャラ,
9,肯定・同意のバリエーション,Agree! Efficiency Huge Font,"Standard agreement words like 'I agree', 'Same here', and 'Good'. Huge fonts to show your support with minimal energy during group chats.",全力同意！省エネで賛成するサラリーマンのデカ文字,「賛成」「それな」「いいですね」など、同意のバリエーションを網羅。グループチャットの議論を省エネで盛り上げ、自分の存在感をしっかり示せるビジネスマンの味方。,©ryo,TRUE,ほんわか・癒し,男性キャラ,
10,会話終了・挨拶の省エネ,Sign Off Huge Font: Goodbye,"Standard closings like 'See ya', 'Good night', and 'Bye'. Huge fonts to end the conversation politely without wasting your energy.",省エネで締める！会話をスマートに終えるデカ文字,「また明日」「おやすみ」「さらば」など、やり取りを締めくくる標準ワード。ダラダラ続くチャットを角を立てずに切り上げ、自分の時間を省エネで確保するための必需品。,©ryo,TRUE,挨拶,男性キャラ,
